{
  "$schema": "https://json-schema.org/draft/2020-12/schema",
  "$id": "https://example.invalid/schemas/cadre-runner-capabilities.schema.json",
  "title": "Cadre runner capability manifest (roster/runner-capabilities.json)",
  "description": "Declarative, build-time source of truth for the data idea #8 (REQ-CADRE-BACKLOG-8) found hardcoded across generate_global_plugin.py's CAPABILITY_PROFILES/ALLOWED_MODELS/ALLOWED_CODEX_MODELS/ALLOWED_REASONING_EFFORTS, generate_role_metadata.py's TIER_MAP, and the structural runner-divergence facts from .agents/skills/run-agent-orchestration/references/runner-adapters.md (CM-FR-1..8, plus native_workspace_isolation and the prompt_hook_*/tool_gate_* pair added later). Read at build time by roster/orchestration/src/generate_global_plugin.py and generate_role_metadata.py, which load capability_tiers/model_tiers/allowed_reasoning_efforts directly with stdlib json so those Python constants can never drift from this file, and ALSO at dispatch time by roster/orchestration/mcp/dispatch_core.py (model_tiers) and mcp/api_runner.py (capability_tiers, deciding fail-closed which tools an api-runner dispatch offers). OD-2 is therefore narrower than 'this file has no runtime consumer', and the narrow form is the part that matters: the runner-divergence facts -- native_workspace_isolation and the prompt_hook_*/tool_gate_* pair -- are descriptive build-time data that no dispatch-time code path may branch on, because tool_gate_support names an enforcement boundary and code that skipped a check because a data file said 'none' would be a security control decided by JSON (see requirements.md OD-2 disposition; roster/orchestration/test/test_runner_capabilities.py enforces it across every module under roster/orchestration/). This schema validates the manifest's own shape/type/enum content in isolation, matching roster/catalog.schema.json's precedent (Draft 2020-12, validated by a jsonschema-guarded standalone check, never a required runtime dependency of the generators themselves).",
  "type": "object",
  "additionalProperties": false,
  "required": ["version", "capability_tiers", "model_tiers", "allowed_reasoning_efforts", "runners"],
  "properties": {
    "$schema": { "type": "string" },
    "version": { "const": 1 },
    "capability_tiers": {
      "type": "object",
      "additionalProperties": false,
      "required": ["read_only", "document_author", "code_author", "test_author", "environment_operator"],
      "properties": {
        "read_only": { "$ref": "#/$defs/capability_tier" },
        "document_author": { "$ref": "#/$defs/capability_tier" },
        "code_author": { "$ref": "#/$defs/capability_tier" },
        "test_author": { "$ref": "#/$defs/capability_tier" },
        "environment_operator": { "$ref": "#/$defs/capability_tier" }
      }
    },
    "model_tiers": {
      "type": "object",
      "additionalProperties": false,
      "required": ["opus", "sonnet", "haiku"],
      "properties": {
        "opus": { "$ref": "#/$defs/model_tier" },
        "sonnet": { "$ref": "#/$defs/model_tier" },
        "haiku": { "$ref": "#/$defs/model_tier" }
      }
    },
    "allowed_reasoning_efforts": {
      "type": "array",
      "minItems": 1,
      "uniqueItems": true,
      "items": { "enum": ["low", "medium", "high", "xhigh"] }
    },
    "runners": {
      "type": "object",
      "additionalProperties": false,
      "required": ["claude-code", "codex", "cline", "api", "hermes"],
      "properties": {
        "claude-code": { "$ref": "#/$defs/runner" },
        "codex": { "$ref": "#/$defs/runner" },
        "cline": { "$ref": "#/$defs/runner" },
        "api": { "$ref": "#/$defs/runner" },
        "hermes": { "$ref": "#/$defs/runner" }
      }
    }
  },
  "$defs": {
    "capability_tier": {
      "type": "object",
      "additionalProperties": false,
      "required": ["tools", "sandbox_mode"],
      "properties": {
        "tools": { "type": "array", "minItems": 1, "items": { "type": "string", "minLength": 1 } },
        "sandbox_mode": { "type": "string", "minLength": 1 }
      }
    },
    "model_tier": {
      "type": "object",
      "additionalProperties": false,
      "required": ["codex_model", "reasoning_effort", "cline_tier"],
      "properties": {
        "codex_model": { "enum": ["gpt-5.6-luna", "gpt-5.6-terra", "gpt-5.6-sol"] },
        "reasoning_effort": { "enum": ["low", "medium", "high", "xhigh"] },
        "cline_tier": { "enum": ["low", "mid", "high"] }
      }
    },
    "runner": {
      "type": "object",
      "additionalProperties": false,
      "required": [
        "has_generated_wrapper",
        "dispatch_naming",
        "communication_mode_peer_support",
        "peer_support_gate",
        "nested_teams_supported",
        "team_size_guidance",
        "named_agent_dispatch_supported",
        "named_agent_dispatch_workaround",
        "concurrency_bound_config_key",
        "native_workspace_isolation",
        "prompt_hook_support",
        "prompt_hook_mechanism",
        "tool_gate_support",
        "tool_gate_mechanism"
      ],
      "properties": {
        "has_generated_wrapper": { "type": "boolean" },
        "dispatch_naming": { "type": ["string", "null"] },
        "communication_mode_peer_support": { "enum": ["yes", "no", "gated", "best_effort"] },
        "peer_support_gate": { "type": ["string", "null"] },
        "nested_teams_supported": { "enum": [true, false, "not_applicable"] },
        "team_size_guidance": {
          "type": ["object", "null"],
          "additionalProperties": false,
          "required": ["minimum", "maximum", "note"],
          "properties": {
            "minimum": { "type": "integer", "minimum": 1 },
            "maximum": { "type": "integer", "minimum": 1 },
            "note": { "type": "string" }
          }
        },
        "named_agent_dispatch_supported": { "type": "boolean" },
        "named_agent_dispatch_workaround": { "type": ["string", "null"] },
        "concurrency_bound_config_key": { "type": ["string", "null"] },
        "native_workspace_isolation": {
          "description": "Which runner-native mechanism, if any, isolates a dispatched role's edits into a separate workspace before it runs (see roster/shared/workspace-isolation.md, which every write-capable role follows regardless of this value). Build-time descriptive data only -- no dispatch-time code currently reads this field (matching this manifest's own OD-2 disposition for its other fields).",
          "enum": ["worktree", null]
        },
        "prompt_hook_support": {
          "description": "Whether the runner can run something on every user prompt BEFORE the model sees it, and whether that thing can put text into the model's context. \"context_injection\": the hook's output reaches the model. \"dispatch_only\": a hook fires but its output is discarded, so it can observe and act out-of-band but cannot steer the turn -- distinguished from \"none\" because the two look identical from inside a hook script, which runs and exits 0 either way. \"none\": no per-prompt hook surface at all. Descriptive only; nothing branches on it at dispatch time.",
          "enum": ["context_injection", "dispatch_only", "none"]
        },
        "prompt_hook_mechanism": {
          "description": "The concrete per-prompt surface named in runner-adapters.md, or null when prompt_hook_support is \"none\". For \"dispatch_only\" this must say what is discarded, not just what exists.",
          "type": ["string", "null"]
        },
        "tool_gate_support": {
          "description": "Whether a hook can refuse a tool call in the user's OWN session (not merely in a subagent session the suite itself starts). \"blocking\": the runner awaits the hook and honors a refusal. \"advisory\": a hook observes the call but cannot stop it. \"none\": no pre-tool hook surface. This is the field that decides whether an orchestration policy is enforceable on a runner or is only a strong suggestion.",
          "enum": ["blocking", "advisory", "none"]
        },
        "tool_gate_mechanism": {
          "description": "The concrete pre-tool surface and the shape of a refusal, or null when tool_gate_support is \"none\".",
          "type": ["string", "null"]
        }
      }
    }
  }
}
