{
  "$schema": "runner-capabilities.schema.json",
  "version": 1,
  "capability_tiers": {
    "read_only": {
      "tools": [
        "Read",
        "Grep",
        "Glob"
      ],
      "sandbox_mode": "read-only"
    },
    "document_author": {
      "tools": [
        "Read",
        "Grep",
        "Glob",
        "Bash",
        "Edit",
        "Write"
      ],
      "sandbox_mode": "workspace-write"
    },
    "code_author": {
      "tools": [
        "Read",
        "Grep",
        "Glob",
        "Bash",
        "Edit",
        "Write"
      ],
      "sandbox_mode": "workspace-write"
    },
    "test_author": {
      "tools": [
        "Read",
        "Grep",
        "Glob",
        "Bash",
        "Edit",
        "Write"
      ],
      "sandbox_mode": "workspace-write"
    },
    "environment_operator": {
      "tools": [
        "Read",
        "Grep",
        "Glob",
        "Bash",
        "Edit",
        "Write"
      ],
      "sandbox_mode": "workspace-write"
    }
  },
  "model_tiers": {
    "opus": {
      "codex_model": "gpt-5.6-sol",
      "reasoning_effort": "high",
      "cline_tier": "high"
    },
    "sonnet": {
      "codex_model": "gpt-5.6-terra",
      "reasoning_effort": "medium",
      "cline_tier": "mid"
    },
    "haiku": {
      "codex_model": "gpt-5.6-luna",
      "reasoning_effort": "low",
      "cline_tier": "low"
    }
  },
  "allowed_reasoning_efforts": [
    "low",
    "medium",
    "high",
    "xhigh"
  ],
  "runners": {
    "claude-code": {
      "has_generated_wrapper": true,
      "dispatch_naming": "agents:<role-id> (plugin-installed) or bare <role-id> (project-local override)",
      "communication_mode_peer_support": "gated",
      "peer_support_gate": "CLAUDE_CODE_EXPERIMENTAL_AGENT_TEAMS=1",
      "nested_teams_supported": false,
      "team_size_guidance": {
        "minimum": 3,
        "maximum": 5,
        "note": "disjoint file ownership per teammate"
      },
      "named_agent_dispatch_supported": true,
      "named_agent_dispatch_workaround": null,
      "concurrency_bound_config_key": null,
      "native_workspace_isolation": "worktree",
      "prompt_hook_support": "context_injection",
      "prompt_hook_mechanism": "UserPromptSubmit hook. Exit 0 with stdout, or a top-level additionalContext field, injects context the model acts on; exit 2 (or decision \"block\") blocks the prompt and erases it",
      "tool_gate_support": "blocking",
      "tool_gate_mechanism": "PreToolUse hook returning hookSpecificOutput.permissionDecision \"deny\" with a permissionDecisionReason that reaches the model"
    },
    "codex": {
      "has_generated_wrapper": true,
      "dispatch_naming": ".codex/agents/<role-id>.toml (project) or ~/.codex/agents/agents-<role-id>.toml (global)",
      "communication_mode_peer_support": "no",
      "peer_support_gate": null,
      "nested_teams_supported": "not_applicable",
      "team_size_guidance": null,
      "named_agent_dispatch_supported": false,
      "named_agent_dispatch_workaround": "dispatch_secure_cloud_role MCP tool (cadre mcp-dispatch-server), preferred; manual per-file developer_instructions injection into spawn_agent, fallback",
      "concurrency_bound_config_key": "agents.max_concurrent_threads_per_session (native spawn_agent) or MAX_CONCURRENT_CHILDREN (this repo's MCP dispatch server path)",
      "native_workspace_isolation": null,
      "prompt_hook_support": "context_injection",
      "prompt_hook_mechanism": "userPromptSubmit lifecycle hook (HookEventName in the app-server protocol schema); a command/mcp_tool handler emits a \"context\" HookOutputEntry, spilled to disk above ConfiguredHookHandler.additionalContextLimit (default ~2500 tokens). The config.toml table shape is not in docs/config.md -- verify against an installed codex before relying on it",
      "tool_gate_support": "blocking",
      "tool_gate_mechanism": "preToolUse/permissionRequest lifecycle hook emitting a \"stop\" HookOutputEntry"
    },
    "cline": {
      "has_generated_wrapper": true,
      "dispatch_naming": "start_subagent tool's preset: \"<role-id>\" argument (cline-agents plugin; role-id matches each bundled agents/<role-id>.md preset's name frontmatter)",
      "communication_mode_peer_support": "best_effort",
      "peer_support_gate": null,
      "nested_teams_supported": "not_applicable",
      "team_size_guidance": null,
      "named_agent_dispatch_supported": true,
      "named_agent_dispatch_workaround": null,
      "concurrency_bound_config_key": null,
      "native_workspace_isolation": null,
      "prompt_hook_support": "dispatch_only",
      "prompt_hook_mechanism": "A UserPromptSubmit hook file under <workspace>/.cline/hooks (or .clinerules/hooks) IS executed, but is spawned detached with only a logging catch and its stdout is never read -- contextModification cannot reach the model. Verified against @cline/core 0.0.65 and 0.0.71; cline-plugins/cline/hook-surface.test.mts is the executable form",
      "tool_gate_support": "blocking",
      "tool_gate_mechanism": "PreToolUse hook file under <workspace>/.cline/hooks (or .clinerules/hooks); unlike every other event it is spawned non-detached with a timeout, awaited, and its stdout parsed, so {\"cancel\": true} returns to the runtime as {stop: true}"
    },
    "api": {
      "has_generated_wrapper": false,
      "dispatch_naming": "dispatch_secure_cloud_role MCP tool with runner=\"api\" (reuses the Codex .toml wrappers for developer_instructions/sandbox_mode; the model comes from runners.local_model_<tier>, not the wrapper). Spawns no coding CLI, so it has no OS-level sandbox -- file tools are confined in-process by path resolution only; see roster/orchestration/SECURITY-CONTROLS.md's 'API runner' section",
      "communication_mode_peer_support": "no",
      "peer_support_gate": null,
      "nested_teams_supported": "not_applicable",
      "team_size_guidance": null,
      "named_agent_dispatch_supported": true,
      "named_agent_dispatch_workaround": null,
      "concurrency_bound_config_key": "MAX_CONCURRENT_CHILDREN (this repo's MCP dispatch server path)",
      "native_workspace_isolation": null,
      "prompt_hook_support": "none",
      "prompt_hook_mechanism": null,
      "tool_gate_support": "none",
      "tool_gate_mechanism": null
    },
    "hermes": {
      "has_generated_wrapper": true,
      "dispatch_naming": "delegate_task(goal, context) with the role skill's contract as context; the skill name is the role id (hermes-plugins/skills/cadre/<domain>/<role-id>/SKILL.md, loaded with skill_view)",
      "communication_mode_peer_support": "no",
      "peer_support_gate": null,
      "nested_teams_supported": false,
      "team_size_guidance": null,
      "named_agent_dispatch_supported": false,
      "named_agent_dispatch_workaround": "skill_view the role skill and pass its contract verbatim as delegate_task context, with the working directory from pwd; the cadre-orchestrator skill's Dispatch Protocol is that procedure",
      "concurrency_bound_config_key": "delegation.max_concurrent_children",
      "native_workspace_isolation": null,
      "prompt_hook_support": "none",
      "prompt_hook_mechanism": null,
      "tool_gate_support": "blocking",
      "tool_gate_mechanism": "pre_tool_call hook: a shell hook under hooks: in cli-config.yaml or a plugin hook; stdout {\"action\": \"block\", \"message\": ...} (or the Claude-Code-style {\"decision\": \"block\"}) refuses the call before it runs. delegation.worktree_isolation (default false) gives each child its own worktree when enabled; off by default, so native_workspace_isolation stays null"
    }
  }
}
